{
  "$schema": "https://json-schema.org/draft/2020-12/schema",
  "title": "Asqav wire vocabulary reference",
  "type": "object",
  "additionalProperties": false,
  "required": [
    "schema_version", "source_note", "receipt_types", "request_extra_types",
    "decisions", "policy_decisions", "decision_map", "capture_topologies",
    "sandbox_states", "applied_outcomes", "witnesses", "taxonomy_order",
    "fields", "profiles",
    "metadata_order", "metadata", "standard_risk_classes",
    "dora_incident_classes", "hipaa_incident_classes"
  ],
  "properties": {
    "schema_version": {"type": "integer", "const": 2},
    "source_note": {"$ref": "#/$defs/text"},
    "receipt_types": {"$ref": "#/$defs/tokens"},
    "request_extra_types": {"$ref": "#/$defs/tokens"},
    "decisions": {"$ref": "#/$defs/tokens"},
    "policy_decisions": {"$ref": "#/$defs/tokens"},
    "capture_topologies": {"$ref": "#/$defs/tokens"},
    "sandbox_states": {"$ref": "#/$defs/tokens"},
    "applied_outcomes": {"$ref": "#/$defs/tokens"},
    "witnesses": {"$ref": "#/$defs/tokens"},
    "taxonomy_order": {"$ref": "#/$defs/tokens"},
    "metadata_order": {"$ref": "#/$defs/tokens"},
    "standard_risk_classes": {"$ref": "#/$defs/tokens"},
    "dora_incident_classes": {"$ref": "#/$defs/tokens"},
    "hipaa_incident_classes": {"$ref": "#/$defs/tokens"},
    "metadata": {
      "type": "object", "minProperties": 43, "maxProperties": 43,
      "propertyNames": {"enum": [
        "result_digest", "expires_at", "nonce", "tool_fingerprint",
        "config_manifest_digest", "cve_inventory_digest", "executable_hash",
        "sbom_digest", "slsa_provenance_pointer", "supply_chain_pointer",
        "mitre_techniques", "mitre_atlas", "owasp_llm_top10", "nist_ai_rmf",
        "iso_42001", "eu_ai_act_articles", "rfc3161_timestamp",
        "framework_mappings_self_declared", "witness_policy", "risk_class",
        "incident_class", "authorized_under_mandate", "controls_evaluated",
        "approver_id", "initiator_id", "acceptance_reason", "accepted_at",
        "supersedes", "sarif_digest", "finding_ref", "approval_ref", "invocation_ref",
        "risk_snapshot", "repo_ref", "commit_sha", "base_sha", "change_digest",
        "change_ref", "change_approval_ref", "change_class", "authored_by",
        "user_intent", "user_intent_verified"
      ]},
      "additionalProperties": {"$ref": "#/$defs/metadata"}
    },
    "decision_map": {
      "type": "array", "minItems": 1, "uniqueItems": true,
      "items": {
        "type": "array", "minItems": 2, "maxItems": 2,
        "items": {"$ref": "#/$defs/token"}
      }
    },
    "fields": {
      "type": "object", "minProperties": 1,
      "propertyNames": {"pattern": "^[a-z][a-z0-9_]*$", "not": {"pattern": "\\s"}},
      "additionalProperties": {"$ref": "#/$defs/taxonomy"}
    },
    "profiles": {
      "type": "object", "additionalProperties": false,
      "required": ["receipt_profile", "receipt_request", "sdk_incident"],
      "properties": {
        "receipt_profile": {"$ref": "#/$defs/tokens"},
        "receipt_request": {"$ref": "#/$defs/tokens"},
        "sdk_incident": {"$ref": "#/$defs/tokens"}
      }
    }
  },
  "$defs": {
    "text": {"type": "string", "minLength": 1, "pattern": "\\S"},
    "token": {"type": "string", "pattern": "^[a-z][a-z0-9_:]*$", "not": {"pattern": "\\s"}},
    "tokens": {
      "type": "array", "minItems": 1, "uniqueItems": true,
      "items": {"$ref": "#/$defs/token"}
    },
    "metadata": {
      "type": "object", "additionalProperties": false,
      "required": ["form", "description"],
      "properties": {
        "form": {"$ref": "#/$defs/text"},
        "description": {"$ref": "#/$defs/text"}
      }
    },
    "taxonomy": {
      "type": "object", "additionalProperties": false,
      "required": ["typescript_option", "metadata_ref", "list_entry_max_length"],
      "properties": {
        "typescript_option": {
          "type": "string", "pattern": "^[a-z][a-zA-Z0-9]*$", "not": {"pattern": "\\s"}
        },
        "metadata_ref": {"$ref": "#/$defs/token"},
        "list_entry_max_length": {"type": "integer", "minimum": 1}
      }
    }
  }
}
