{
  "schema_version": 2,
  "source_note": "Reference snapshot of public wire vocabulary; consumers apply their own validation policies.",
  "receipt_types": [
    "protectmcp:decision",
    "protectmcp:restraint",
    "protectmcp:lifecycle",
    "protectmcp:lifecycle:configuration_change",
    "protectmcp:lifecycle:risk_acceptance",
    "protectmcp:lifecycle:code_authorship",
    "protectmcp:acknowledgment",
    "protectmcp:observation",
    "protectmcp:observation:result_bound"
  ],
  "request_extra_types": [
    "authoritative"
  ],
  "decisions": [
    "allow",
    "deny",
    "rate_limit",
    "observation"
  ],
  "policy_decisions": [
    "permit",
    "deny",
    "rate_limit",
    "none"
  ],
  "decision_map": [
    [
      "permit",
      "allow"
    ],
    [
      "allow",
      "allow"
    ],
    [
      "deny",
      "deny"
    ],
    [
      "rate_limit",
      "rate_limit"
    ],
    [
      "none",
      "observation"
    ]
  ],
  "capture_topologies": [
    "in_process_sdk",
    "network_proxy",
    "browser_extension",
    "mcp_proxy",
    "passive_telemetry",
    "github_sha_pull"
  ],
  "sandbox_states": [
    "enabled",
    "disabled",
    "unavailable"
  ],
  "applied_outcomes": [
    "success",
    "fail",
    "partial",
    "cancelled",
    "timed_out"
  ],
  "witnesses": [
    "rfc3161",
    "opentimestamps"
  ],
  "taxonomy_order": [
    "mitre_techniques",
    "mitre_atlas",
    "owasp_llm_top10",
    "nist_ai_rmf",
    "iso_42001",
    "eu_ai_act_articles"
  ],
  "fields": {
    "mitre_techniques": {
      "typescript_option": "mitreTechniques",
      "list_entry_max_length": 128,
      "metadata_ref": "mitre_techniques"
    },
    "mitre_atlas": {
      "typescript_option": "mitreAtlas",
      "list_entry_max_length": 128,
      "metadata_ref": "mitre_atlas"
    },
    "owasp_llm_top10": {
      "typescript_option": "owaspLlmTop10",
      "list_entry_max_length": 128,
      "metadata_ref": "owasp_llm_top10"
    },
    "nist_ai_rmf": {
      "typescript_option": "nistAiRmf",
      "list_entry_max_length": 128,
      "metadata_ref": "nist_ai_rmf"
    },
    "iso_42001": {
      "typescript_option": "iso42001",
      "list_entry_max_length": 128,
      "metadata_ref": "iso_42001"
    },
    "eu_ai_act_articles": {
      "typescript_option": "euAiActArticles",
      "list_entry_max_length": 128,
      "metadata_ref": "eu_ai_act_articles"
    }
  },
  "profiles": {
    "receipt_profile": [
      "receipt_types"
    ],
    "receipt_request": [
      "receipt_types",
      "request_extra_types"
    ],
    "sdk_incident": [
      "dora_incident_classes",
      "hipaa_incident_classes"
    ]
  },
  "dora_incident_classes": [
    "cybersecurity_related",
    "process_failure",
    "system_failure",
    "external_event",
    "payment_related",
    "other"
  ],
  "hipaa_incident_classes": [
    "hipaa_security_incident"
  ],
  "standard_risk_classes": [
    "low",
    "medium",
    "high",
    "unknown"
  ],
  "metadata_order": [
    "result_digest",
    "expires_at",
    "nonce",
    "tool_fingerprint",
    "config_manifest_digest",
    "cve_inventory_digest",
    "executable_hash",
    "sbom_digest",
    "slsa_provenance_pointer",
    "supply_chain_pointer",
    "mitre_techniques",
    "mitre_atlas",
    "owasp_llm_top10",
    "nist_ai_rmf",
    "iso_42001",
    "eu_ai_act_articles",
    "rfc3161_timestamp",
    "framework_mappings_self_declared",
    "witness_policy",
    "risk_class",
    "incident_class",
    "authorized_under_mandate",
    "controls_evaluated",
    "approver_id",
    "initiator_id",
    "acceptance_reason",
    "accepted_at",
    "supersedes",
    "sarif_digest",
    "finding_ref",
    "approval_ref",
    "invocation_ref",
    "risk_snapshot",
    "repo_ref",
    "commit_sha",
    "base_sha",
    "change_digest",
    "change_ref",
    "change_approval_ref",
    "change_class",
    "authored_by",
    "user_intent",
    "user_intent_verified"
  ],
  "metadata": {
    "result_digest": {
      "form": "sha256:<64 hex>",
      "description": "SHA-256 of canonical-JSON tool response bytes (sha256:<64 hex>). Binds output into the receipt; pairs with receipt_type=protectmcp:observation:result_bound."
    },
    "expires_at": {
      "form": "RFC 3339 timestamp",
      "description": "RFC 3339 receipt-expiry timestamp. Verifier returns validation_label='signature_expired' when current_time > expires_at."
    },
    "nonce": {
      "form": "24 lowercase hex chars",
      "description": "Server-issued per-receipt nonce (24 lowercase hex chars) minted by secrets.token_hex(12) on the sign route, bound into the signed bytes under compliance_mode. Pair it with expires_at for the enforced time bound."
    },
    "tool_fingerprint": {
      "form": "32 lowercase hex chars",
      "description": "SHA-256[:32] over tool_name|schema_canonical_json|module_path (32 lowercase hex). SDK-supplied at sign-time; surfaces naming collisions and registry-shadow drift."
    },
    "config_manifest_digest": {
      "form": "sha256:<64 hex>",
      "description": "SHA-256 of canonical-JSON MCP server manifest (sha256:<64 hex>). REQUIRED on receipt_type=protectmcp:lifecycle:configuration_change."
    },
    "cve_inventory_digest": {
      "form": "sha256:<64 hex>",
      "description": "SHA-256 over canonical-JSON CVE inventory at sign-time (sha256:<64 hex>). Enables known-at-sign-time vs disclosed-later audit."
    },
    "executable_hash": {
      "form": "sha256:<64 hex>",
      "description": "SHA-256 of the executable that invoked the action (sha256:<64 hex>). Binds build-side provenance; pairs with sbom_digest, slsa_provenance_pointer, supply_chain_pointer."
    },
    "sbom_digest": {
      "form": "sha256:<64 hex>",
      "description": "SHA-256 of the canonical CycloneDX or SPDX SBOM document covering the executing image (sha256:<64 hex>). Optional; bound into the signed receipt."
    },
    "slsa_provenance_pointer": {
      "form": "https URL",
      "description": "https URL to the SLSA attestation envelope for the executing build."
    },
    "supply_chain_pointer": {
      "form": "https URL",
      "description": "https URL to the in-toto, Sigstore, or Rekor entry covering the executing build."
    },
    "mitre_techniques": {
      "form": "list of MITRE ATT&CK technique ids",
      "description": "Caller-supplied list of MITRE ATT&CK technique ids (e.g. T1059, T1078). Self-declared; auto-flips framework_mappings_self_declared to True. Never Asqav-verified."
    },
    "mitre_atlas": {
      "form": "list of MITRE ATLAS ids",
      "description": "Caller-supplied list of MITRE ATLAS ids for AI-system threats (e.g. AML.T0051). Self-declared; auto-flips framework_mappings_self_declared to True. Never Asqav-verified."
    },
    "owasp_llm_top10": {
      "form": "list of OWASP Top 10 for LLM ids",
      "description": "Caller-supplied list of OWASP Top 10 for LLM ids (e.g. LLM01, LLM02). Self-declared; auto-flips framework_mappings_self_declared to True. Never Asqav-verified."
    },
    "nist_ai_rmf": {
      "form": "list of NIST AI RMF function ids",
      "description": "Caller-supplied list of NIST AI RMF function ids (GOVERN | MAP | MEASURE | MANAGE plus subcategories). Self-declared; auto-flips framework_mappings_self_declared to True."
    },
    "iso_42001": {
      "form": "list of ISO/IEC 42001 control ids",
      "description": "Caller-supplied list of ISO/IEC 42001 control ids (e.g. A.6.2.6). Self-declared; auto-flips framework_mappings_self_declared to True. Never Asqav-verified."
    },
    "eu_ai_act_articles": {
      "form": "list of EU AI Act article ids",
      "description": "Caller-supplied list of EU AI Act article ids (e.g. Article-12, Article-15, Article-50). Self-declared; auto-flips framework_mappings_self_declared to True. Never Asqav-verified."
    },
    "rfc3161_timestamp": {
      "form": "base64 TimeStampResp",
      "description": "Caller-supplied base64-encoded RFC 3161 TimeStampResp (DER) preserved on the receipt for offline TSA chain verification."
    },
    "framework_mappings_self_declared": {
      "form": "boolean",
      "description": "False-attestation guard. Server-set to True when any of mitre_techniques, mitre_atlas, owasp_llm_top10, nist_ai_rmf, iso_42001, or eu_ai_act_articles is populated; verification surface displays the caller-supplied label."
    },
    "witness_policy": {
      "form": "{required: int, witnesses: [rfc3161, opentimestamps]}",
      "description": "Caller-declared N-of-M durable-anchoring quorum {required: int, witnesses: [rfc3161, opentimestamps]}. required is in [1, len(witnesses)]; witnesses is a non-empty subset of the two shipped witnesses. rekor is rejected. The receipt reaches witness_quorum_met only when required witnesses hold a real inclusion proof."
    },
    "risk_class": {
      "form": "low | medium | high | unknown",
      "description": "Deployer risk classification of the Action. Controlled vocabulary: low | medium | high | unknown."
    },
    "incident_class": {
      "form": "DORA ITS string or array of strings",
      "description": "DORA ITS incident classification; string or array of strings for multi-regime classification (e.g. DORA + CIRCIA)."
    },
    "authorized_under_mandate": {
      "form": "{mandate_id, issuer_id, scope_digest, verified}",
      "description": "Server-built mandate attestation {mandate_id, issuer_id, scope_digest, verified}. verified=true is self-declared issuer authority, the same trust level as framework_mappings_self_declared, never Asqav-verified third-party authorization. scope_digest is verifiable by resolving mandate_id via GET /orgs/{org_id}/mandates/{mandate_id}."
    },
    "controls_evaluated": {
      "form": "{emergency_halt, delegation_scope?, quorum?, mandate?, policy?, content_scan?, result}",